"title","price","rating","amenities","numero_registro","reviews","Dormitorio 1","Dormitorio 2"
"Pequeño loft ,junto a la montaña.","44 €","4,82 (543)","['Vistas al jardín', 'Bañera', 'Gel de ducha', 'Agua caliente', 'Gel de ducha', 'Lavadora en el edificio (Gratis)', 'Servicios básicos', 'Ropa de cama', 'Almohadas y mantas adicionales', 'Persianas o cortinas opacas', 'Plancha', 'Tendedero para ropa', 'Mosquitera', 'Espacio para guardar la ropa: armario', 'TV', 'Libros y material de lectura', 'Cuna: disponible previa solicitud', 'Parque/cunas de viaje', 'Libros y juguetes para niños', 'Platos y cubiertos para niños', 'Seguros para ventanas', 'Juegos de mesa', 'Sistema de aire acondicionado sin conductos tipo split', 'Sistema de calefacción sin conductos tipo split', 'Detector de humo', 'Detector de monóxido de carbono', 'Wifi', 'Zona para trabajar', 'Cocina', 'Frigorífico de mininevera ikea', 'Microondas', 'Utensilios básicos de cocina', 'Platos y cubiertos', 'Frigorífico mini', 'Cocina de gas de acero inoxidable', 'Hervidor de agua', 'Cafetera: Nespresso', 'Mesa de comedor', 'Café', 'Entrada independiente', 'Lavandería cercana', 'Patio o balcón compartido', 'Patio trasero privado: Con valla en todo el perímetro', 'Comedor al aire libre', 'Cocina exterior privada', 'Elementos básicos para la playa', 'Aparcamiento gratuito en la entrada dentro de la propiedad: 1 plaza', 'Aparcamiento gratuito en la calle', 'Alojamiento de una altura', 'Admite mascotas', 'Se permite dejar el equipaje', 'Apto para fumadores', 'Disponible para estancias largas', 'Llegada autónoma', 'Cerradura con teclado', 'No disponible: Secadora']","['Anfitrión particular']","[{'rating': 'Valoración: 5\xa0estrellas', 'date': 'Valoración: 5\xa0estrellas,  · Hace 2\xa0días', 'review': 'La habitación está ordenada, las instalaciones están totalmente equipadas y hay un pequeño patio, ¡buena relación calidad-precio!'}, {'rating': 'Valoración: 5\xa0estrellas', 'date': 'Valoración: 5\xa0estrellas,  · Hace 6\xa0días', 'review': '¡Excelente estancia! ¡Buena comunicación!Recomendado !!!'}, {'rating': 'Valoración: 5\xa0estrellas', 'date': 'Valoración: 5\xa0estrellas,  · Hace 1 semana', 'review': 'el alojamiento de Carlos fue perfecto para nuestra necesidad. A 15 minutos del aeropuerto con horarios flexibles.incluso lamentamos no tener tiempo para disfrutar del bonito patio interior.'}, {'rating': 'Valoración: 5\xa0estrellas', 'date': 'Valoración: 5\xa0estrellas,  · Hace 1 semana', 'review': 'Gracias Carlos! Bonito alquiler, bueno para 4 adultos, gran precio'}, {'rating': 'Valoración: 5\xa0estrellas', 'date': 'Valoración: 5\xa0estrellas,  · Hace 1 semana', 'review': 'gran bienvenida, Carlos se toma el tiempo para explicarnos los que hay que saber. Alojamiento que coincide con la descripción y limpio. solo pasamos una noche allí ya que volamos al día siguiente y la casa es más que suficiente y nivel de calidad - precio es lo mejor, situado a 18 minutos del aeropuerto.'}, {'rating': 'Valoración: 5\xa0estrellas', 'date': 'Valoración: 5\xa0estrellas,  · Hace 1 semana', 'review': 'Carlos es una anfitriona muy amable. Siempre responde rápido y es muy flexible y servicial. Airbnb coincide exactamente con las fotos. Tuvimos una estancia fantástica. ¡Recomendable!'}]",NA,NA
"Doble, a metros de Ramblas","60 €","Nuevo","['Aire acondicionado', 'Cerradura en la puerta del dormitorio', 'Botiquín', 'Wifi', 'Cocina', 'No disponible: Cámaras de seguridad en los exteriores de la propiedad', 'No disponible: TV', 'No disponible: Lavadora', 'No disponible: Secadora', 'No disponible: Servicios básicos', 'No disponible: Detector de humo', 'No disponible: Detector de monóxido de carbono', 'No disponible: Calefacción', 'No disponible: Agua caliente']","['Anfitrión particular', 'Número de registro: Exempt']","[]",NA,NA
"Balcón privado para 2 personas cerca de la Sagrada Familia","45 €","4,91 (23)","['Secador de pelo', 'Gel de ducha', 'Agua caliente', 'Gel de ducha', 'Servicios básicos', 'Perchas', 'Ropa de cama', 'Persianas o cortinas opacas', 'Plancha', 'Calefacción', 'Cerradura en la puerta del dormitorio', 'Wifi', 'Cocina', 'Frigorífico', 'Microondas', 'Utensilios básicos de cocina', 'Platos y cubiertos', 'Horno', 'Patio privado o balcón', 'No disponible: Cámaras de seguridad en los exteriores de la propiedad', 'No disponible: TV', 'No disponible: Lavadora', 'No disponible: Secadora', 'No disponible: Aire acondicionado', 'No disponible: Detector de humo', 'No disponible: Detector de monóxido de carbono']","['Anfitrión particular', 'Número de registro: Exempt']","[{'rating': 'Valoración: 5\xa0estrellas', 'date': 'Valoración: 5\xa0estrellas,  · Hace 2 semanas', 'review': 'Gracias! Estuvimos muy bien! <U+2764><U+FE0F>bonita y acogedora habitación; ¡excelente ubicación!'}, {'rating': 'Valoración: 5\xa0estrellas', 'date': 'Valoración: 5\xa0estrellas,  · Hace 3 semanas', 'review': 'Tuvimos una estancia agradable, el apartamento es muy limpio y acogedor, todo el mundo es educado, es tranquilo. También está en el lugar perfecto de Barcelona, no es un entorno demasiado ruidoso y seguro alrededor, pero también cerca de básicamente todo lo que querrías: muchas atracciones turísticas, lugares para comer, supermercados, metro, etc. ¡Recomiendo la estancia aquí al 100%!'}, {'rating': 'Valoración: 5\xa0estrellas', 'date': 'Valoración: 5\xa0estrellas,  · Hace 4 semanas', 'review': 'Probablemente el alojamiento compartido más limpio en el que me he alojado. Excelente opción económica dada la ubicación, buena caminabilidad a lugares de interés para aquellos a los que les gusta estar a pie. Como alternativa, las conexiones de transporte público son geniales. José David y Sandra son súper serviciales y muy receptivos, me sentí en buenas manos todo el tiempo. Recomendado para personas que viajan solas y parejas que buscan un alojamiento sin complicaciones.'}, {'rating': 'Valoración: 5\xa0estrellas', 'date': 'Valoración: 5\xa0estrellas,  · septiembre de 2024', 'review': 'Todo bien, muchas gracias.'}, {'rating': 'Valoración: 5\xa0estrellas', 'date': 'Valoración: 5\xa0estrellas,  · agosto de 2024', 'review': 'Buena hospitalidad. ¡Gracias!'}, {'rating': 'Valoración: 5\xa0estrellas', 'date': 'Valoración: 5\xa0estrellas,  · agosto de 2024', 'review': 'Estancia muy agradable Apartamento níquel de la A a la Z, a 10 minutos a pie del metro Girona que permite ir a la playa o a otro lugar. Tiendas de proximidad junto al alojamiento. Muy recomendable este alojamiento.'}]",NA,NA
"Cómoda y luminosa. Muy cerca Campo del Barça WIFI","43 €","4,92 (284)","['Secador de pelo', 'Champú', 'Acondicionador', 'Gel de ducha', 'Agua caliente', 'Gel de ducha', 'Lavadora en el alojamiento (Gratis)', 'Servicios básicos', 'Perchas', 'Ropa de cama', 'Almohadas y mantas adicionales', 'Persianas o cortinas opacas', 'Plancha', 'Tendedero para ropa', 'Espacio para guardar la ropa', 'Aire acondicionado centralizado', 'Calefacción', 'Cerradura en la puerta del dormitorio', 'Botiquín', 'Wifi', 'Zona para trabajar', 'Cocina', 'Frigorífico', 'Microondas', 'Utensilios básicos de cocina', 'Platos y cubiertos', 'Frigorífico mini', 'Congelador', 'Lavavajillas', 'Fogón', 'Horno', 'Hervidor de agua', 'Cafetera', 'Tostadora', 'Patio o balcón compartido', 'Aparcamiento gratuito en la calle', 'Ascensor', 'Aparcamiento de pago fuera de las instalaciones', 'Alojamiento de una altura', 'Se permite dejar el equipaje', 'Apto para fumadores', 'Disponible para estancias largas', 'Recepción por parte del anfitrión', 'No disponible: Cámaras de seguridad en los exteriores de la propiedad', 'No disponible: TV', 'No disponible: Secadora', 'No disponible: Detector de humo', 'No disponible: Detector de monóxido de carbono']","['Anfitrión particular', 'Número de registro: Exempt']","[{'rating': 'Valoración: 5\xa0estrellas', 'date': 'Valoración: 5\xa0estrellas,  · Hace 2 semanas', 'review': 'Excelente lugar, area tranquila y estrategica, a unos pasos del metro de Badal.Gina muy amablemente me dio tips para el uso del metro en Barcelona.El ambiente es acogedor, limpio y ordenado. Me hizo sentir como en casa. Super recomendado!'}, {'rating': 'Valoración: 5\xa0estrellas', 'date': 'Valoración: 5\xa0estrellas,  · octubre de 2024', 'review': 'Anfitrión muy positivo y cooperativo, recomendable para quedarse en Barcelona'}, {'rating': 'Valoración: 5\xa0estrellas', 'date': 'Valoración: 5\xa0estrellas,  · septiembre de 2024', 'review': 'Muy buena comunicación. Gina envía muy buenas instrucciones sobre cómo llegar al apartamento. También nos proporcionó información sobre cómo viajar por Barcelona a todos los lugares a los que queríamos llegar. Una estancia muy agradable.'}, {'rating': 'Valoración: 5\xa0estrellas', 'date': 'Valoración: 5\xa0estrellas,  · septiembre de 2024', 'review': 'Todo muy bien y de acuerdo a la descripción. Gina siempre fue muy atenta dando tips de como transportarse en la ciudad y siempre respondió muy rápido. Definitivamente volvería.'}, {'rating': 'Valoración: 4\xa0estrellas', 'date': 'Valoración: 4\xa0estrellas,  · septiembre de 2024', 'review': 'Hemos disfrutado :)'}, {'rating': 'Valoración: 5\xa0estrellas', 'date': 'Valoración: 5\xa0estrellas,  · septiembre de 2024', 'review': 'Excelente la recepción de Gina, súper amable y atenta a cualquier duda o necesidad, el lugar queda cercano a un metro súper bien conectado con el resto de la ciudad, un agrado total hospedarse con ella, la habitación igual que en la fotografía cuenta con todo lo necesario para una estadía cómoda y poder preparar el día a día.'}]",NA,NA
"Habitacion compartida en piso con  dos personas","51 €","4,85 (153)","['Secador de pelo', 'Productos de limpieza', 'Champú', 'Gel de ducha', 'Agua caliente', 'Gel de ducha', 'Servicios básicos', 'Perchas', 'Ropa de cama', 'Almohadas y mantas adicionales', 'Persianas o cortinas opacas', 'Plancha', 'Espacio para guardar la ropa', 'TV', 'Cerradura en la puerta del dormitorio', 'Wifi', 'Cocina', 'Frigorífico', 'Microondas', 'Utensilios básicos de cocina', 'Platos y cubiertos', 'Congelador', 'Hervidor de agua', 'Cafetera: cafetera manual de filtro', 'Copas de vino', 'Tostadora', 'Admite mascotas', 'Disponible para estancias largas', 'No disponible: Cámaras de seguridad en los exteriores de la propiedad', 'No disponible: Lavadora', 'No disponible: Secadora', 'No disponible: Aire acondicionado', 'No disponible: Detector de humo', 'No disponible: Detector de monóxido de carbono', 'No disponible: Calefacción']","['Anfitrión particular', 'Número de registro: Exempt']","[{'rating': 'Valoración: 5\xa0estrellas', 'date': 'Valoración: 5\xa0estrellas,  · Hace 1 semana', 'review': 'Todo perfecto'}, {'rating': 'Valoración: 5\xa0estrellas', 'date': 'Valoración: 5\xa0estrellas,  · Hace 1 semana', 'review': 'todo agradable, tuvimos incovenientes con nuestras maletas y ella nos ayudo a solucionar aun cuando nuestra estadia habia acabado, muy agradable, recomendada'}, {'rating': 'Valoración: 5\xa0estrellas', 'date': 'Valoración: 5\xa0estrellas,  · Hace 1 semana', 'review': 'exelente todo! súper recomendado.'}, {'rating': 'Valoración: 5\xa0estrellas', 'date': 'Valoración: 5\xa0estrellas,  · Hace 3 semanas', 'review': 'Anfitrión muy receptivo y, lo más importante, todo está limpio'}, {'rating': 'Valoración: 5\xa0estrellas', 'date': 'Valoración: 5\xa0estrellas,  · Hace 3 semanas', 'review': 'Fue una muy buena estancia en el departamento de Leticia, todo muy ordenado y limpio, responde rápido y siempre estaba disponible a cualquier consulta, además nos permitió dejar nuestras maletas antes del horario de chek in, sin duda lo recomiendo.'}, {'rating': 'Valoración: 5\xa0estrellas', 'date': 'Valoración: 5\xa0estrellas,  · Hace 3 semanas', 'review': 'Fueron muy atentos y el lugar donde nos hospedamos fue perfecto'}]",NA,NA
"VALLS 2 -Antique & Modernist Apt- w/Elevator now!","163 €","4,9 (427)","['Secador de pelo', 'Agua caliente', 'Lavadora', 'Secadora', 'Servicios básicos', 'Perchas', 'Ropa de cama', 'Plancha', 'Tendedero para ropa', 'Espacio para guardar la ropa', 'TV', 'Aire acondicionado', 'Calefacción', 'Extintor de incendios', 'Wifi', 'Cocina', 'Frigorífico', 'Microondas', 'Utensilios básicos de cocina', 'Platos y cubiertos', 'Congelador', 'Horno', 'Hervidor de agua', 'Cafetera', 'Copas de vino', 'Tostadora', 'Mesa de comedor', 'Café', 'Patio privado o balcón', 'Ascensor', 'No disponible: Detector de humo', 'No disponible: Detector de monóxido de carbono']","['Anfitrión profesional', 'Número de registro: HUTB-013068']","[{'rating': 'Valoración: 5\xa0estrellas', 'date': 'Valoración: 5\xa0estrellas,  · septiembre de 2024', 'review': 'Wally se ha comunicado conmigo durante toda la planificación y durante mi estancia. El registro de entrada fue extremadamente fácil y servicial y el apartamento estaba extremadamente bien presentado, limpio y con una ubicación fácil para viajar de ida y vuelta. Definitivamente recomendaría alojarse aquí para cualquier persona que esté planeando visitar Barcelona.'}, {'rating': 'Valoración: 5\xa0estrellas', 'date': 'Valoración: 5\xa0estrellas,  · septiembre de 2024', 'review': 'El alojamiento es 100% consistente con las fotos y la descripción. Fácil acceso y cerca de todo en metro.'}, {'rating': 'Valoración: 5\xa0estrellas', 'date': 'Valoración: 5\xa0estrellas,  · septiembre de 2024', 'review': 'Tuvimos  un excelente  alojamiento ... todo se cumplió en cuanto  a las instalaciones y el entorno.depto  cómodo para 4 personas , sin ruido exterior , cercano a metro, estación de trenes , supermercado etc. Lenka fue muy amable y receptiva.que nos  permitieran dejar las maletas antes del check in en su bodega fue un gran alivio ! Muy recomendable !!!'}, {'rating': 'Valoración: 5\xa0estrellas', 'date': 'Valoración: 5\xa0estrellas,  · septiembre de 2024', 'review': 'Muy satisfechos con nuestra estancia. Wally es muy servicial. El apartamento es moderno, limpio y bien equipado en un hermoso entorno antiguo. La terraza es tranquila; es una ventaja que disfrutamos mucho. Muy contentos con nuestra estancia, volveremos.Gilles y Christine'}, {'rating': 'Valoración: 5\xa0estrellas', 'date': 'Valoración: 5\xa0estrellas,  · agosto de 2024', 'review': 'Somos una familia de 4 personas y fue perfecta para nuestras vacaciones. Amplia, tranquila, excelentes servicios, en particular una cocina muy funcional. Algo que hemos encontrado raro en la mayoría de los alojamientos en Airbnb. También una fabulosa terraza en el balcón trasero y delantero.En cuanto a la ubicación, muy céntrica y a pocos pasos de la estación de metro y tren. Un montón de bonitos restaurantes de tapas cerca y supermercados. Si quieres pasar la noche, especialmente si tienes niños que no pueden quedarse hasta tarde, la televisión tiene un montón de canales de streaming, incluidos Netflix y Disney +.Wally respondió rápidamente, además de muchas instrucciones útiles.Sin duda, el mejor Airbnb en el que nos hemos alojado. Muy recomendable!!'}, {'rating': 'Valoración: 5\xa0estrellas', 'date': 'Valoración: 5\xa0estrellas,  · agosto de 2024', 'review': '¡Pasamos una estancia muy agradable en este alojamiento con mis hermanas! Estaba muy limpio y muy funcional, las sábanas olían bien, todo funciona, todo bien. El apartamento era cómodo. ¡El anfitrión atento y profesional! Lo recomiendo <U+0001F44D><U+0001F3FD>'}]",NA,NA
"Habitación acogedora en Barcelona","44 €","5,0 (5)","['Secador de pelo', 'Productos de limpieza', 'Champú', 'Gel de ducha', 'Agua caliente', 'Gel de ducha', 'Perchas', 'Ropa de cama', 'Persianas o cortinas opacas', 'Espacio para guardar la ropa', 'TV', 'Calefacción', 'Cámaras de seguridad en los exteriores de la propiedad', 'Wifi', 'Zona para trabajar', 'Mesa de comedor', 'Recepción por parte del anfitrión', 'No disponible: Cerradura en la puerta del dormitorio', 'No disponible: Cocina', 'No disponible: Lavadora', 'No disponible: Secadora', 'No disponible: Aire acondicionado', 'No disponible: Servicios básicos', 'No disponible: Detector de humo', 'No disponible: Detector de monóxido de carbono']","['Anfitrión particular', 'Número de registro: Exempt']","[{'rating': 'Valoración: 5\xa0estrellas', 'date': 'Valoración: 5\xa0estrellas,  · Hace 4\xa0días', 'review': 'María Isabel, Julio, el todocariño Billly, su simpático niño, te hacen sentir como en casa. Mejor no pudo ser el hospedaje, gente muy hospitalaria, amable y cercana, sin duda repetiré cuando regresé a Barcelona.'}, {'rating': 'Valoración: 5\xa0estrellas', 'date': 'Valoración: 5\xa0estrellas,  · Hace 1 semana', 'review': 'El alojamiento ha sido muy agradable.  Los anfitriones fueron amables.  Es una bonita familia con un niño de tres años.  No hubo ningún problema con llegar tarde por la noche.  Su perro era obediente y tierno.  Hay una estación de metro cerca del alojamiento.  Si viajas solo, esta es la opción ideal.'}, {'rating': 'Valoración: 5\xa0estrellas', 'date': 'Valoración: 5\xa0estrellas,  · Hace 1 semana', 'review': 'Maria Isabel y su familia brindan un espacio muy acogedor, son súper amables y te ayudan en todo lo que necesites. Su perrito Billy también es muy amoroso. Quedé muy feliz de conocerles. Totalmente recomendado.'}, {'rating': 'Valoración: 5\xa0estrellas', 'date': 'Valoración: 5\xa0estrellas,  · Hace 2 semanas', 'review': 'si viajas solo y buscas un lugar barato para alojarse en Barcelona, ¡la habitación de la casa de María es el lugar!Un poco lejos del centro,  pero muy cerca de una estación de metro directa que puede llevarte fácilmente al centro de la ciudad.La habitación estaba muy limpia y especialmente extremadamente silenciosa por la noche. ¡Dormí increíblemente!María y su marido también son muy acogedores.'}, {'rating': 'Valoración: 5\xa0estrellas', 'date': 'Valoración: 5\xa0estrellas,  · octubre de 2024', 'review': 'Excelente recibimiento por parte de la familia,muy amables y serviciales en todo lo que necesite en mi estancia; billy se lleva un gran aplauso por estar en la puerta esperando a recibirte. Área muy tranquila, se encuentra cerca de muchos lugares para   Lo que necesites hacer.'}]",NA,NA
"Habitación en La Sagrera","44 €","4,73 (51)","['Secador de pelo', 'Champú', 'Gel de ducha', 'Agua caliente', 'Perchas', 'Botiquín', 'Wifi', 'Zona para trabajar', 'Ascensor', 'Aparcamiento de pago en las instalaciones', 'No disponible: Cerradura en la puerta del dormitorio', 'No disponible: Cámaras de seguridad en los exteriores de la propiedad', 'No disponible: Cocina', 'No disponible: TV', 'No disponible: Lavadora', 'No disponible: Secadora', 'No disponible: Aire acondicionado', 'No disponible: Servicios básicos', 'No disponible: Detector de humo', 'No disponible: Detector de monóxido de carbono', 'No disponible: Calefacción']","['Anfitrión particular', 'Número de registro: Exempt']","[{'rating': 'Valoración: 5\xa0estrellas', 'date': 'Valoración: 5\xa0estrellas,  · Hace 6\xa0días', 'review': 'excelente lugar, muy cómodo y buena zona, anfitriones excelente muy atentos y amables.'}, {'rating': 'Valoración: 5\xa0estrellas', 'date': 'Valoración: 5\xa0estrellas,  · Hace 2 semanas', 'review': 'Excelente experiencia y buena estancia, recomiendo los días cerrados'}, {'rating': 'Valoración: 5\xa0estrellas', 'date': 'Valoración: 5\xa0estrellas,  · Hace 2 semanas', 'review': 'el lugar era exactamente lo que estaba buscando y Sofio es un excelente anfitrión. Fue extremadamente complaciente y acogedora. Lo recomendaría al 100%'}, {'rating': 'Valoración: 4\xa0estrellas', 'date': 'Valoración: 4\xa0estrellas,  · Hace 2 semanas', 'review': 'Muy buen recibimiento'}, {'rating': 'Valoración: 5\xa0estrellas', 'date': 'Valoración: 5\xa0estrellas,  · Hace 3 semanas', 'review': 'Tuvimos una buena estancia aquí y el anfitrión fue muy amable, servicial y flexible para permitirnos llegar muy tarde. La habitación era tranquila y todo el lugar perfectamente limpio. ¡Gracias!'}, {'rating': 'Valoración: 5\xa0estrellas', 'date': 'Valoración: 5\xa0estrellas,  · Hace 3 semanas', 'review': 'bueno'}]",NA,NA
"Silencioso entre Gracia y Sagrada Familia","94 €","4,6 (384)","['Secador de pelo', 'Productos de limpieza', 'Champú', 'Gel de ducha', 'Agua caliente', 'Gel de ducha', 'Servicios básicos', 'Perchas', 'Ropa de cama', 'Plancha', 'Espacio para guardar la ropa: armario', 'Conexión Ethernet', 'TV', 'Trona', 'Aire acondicionado centralizado', 'Calefactor portátil', 'Wifi rápido (240 Mbps)', 'Cocina', 'Frigorífico', 'Microondas', 'Utensilios básicos de cocina', 'Platos y cubiertos', 'Congelador', 'Fogón', 'Horno estándar de acero inoxidable', 'Hervidor de agua', 'Copas de vino', 'Tostadora', 'Bandeja de repostería', 'Mesa de comedor', 'Lavandería cercana', 'Patio o balcón', 'Aparcamiento de pago en garaje en la propiedad', 'Alojamiento de una altura', 'Llegada autónoma', 'Cerradura inteligente', 'No disponible: Lavadora', 'No disponible: Secadora', 'No disponible: Detector de humo', 'No disponible: Detector de monóxido de carbono']","['Anfitrión particular', 'Número de registro: HUTB005487']","[{'rating': 'Valoración: 5\xa0estrellas', 'date': 'Valoración: 5\xa0estrellas,  · Hace 2\xa0días', 'review': 'Roberto es muy receptivo, con muy buenos y muchos consejos. la comunicación siempre ha sido fácil. el apartamento estaba muy limpio y muy agradable. una mención+++ para el pequeño balcón muy encantador.Buena ropa de cama muy cómoda.un apartamento muy limpio.'}, {'rating': 'Valoración: 5\xa0estrellas', 'date': 'Valoración: 5\xa0estrellas,  · Hace 6\xa0días', 'review': 'Apartamento muy agradable, ropa de cama cómoda, pequeña calle tranquila y cerca del mercado, conveniente para llegar a pie a la Sagrada Familia, el Park Guell, los restaurantes del barrio de Gracia. Gracias a Roberto por sus indicaciones durante toda la estancia. ¡Ha sido genial!'}, {'rating': 'Valoración: 5\xa0estrellas', 'date': 'Valoración: 5\xa0estrellas,  · Hace 1 semana', 'review': 'Roberto fue un gran anfitrión, respondió de forma rápida y servicial, especialmente al estar en un país diferente. El apartamento era de gran tamaño, las camas eran muy cómodas, la ducha era potente y el apartamento era elegante.  Situado fuera de la carretera principal, pero junto al transporte y restaurantes, tiendas y museos, etc. Una cosa a tener en cuenta, el piso está en el tercer piso sin ascensor. Sin duda, estoy encantado de volver a alojarme aquí.  Gracias Roberto.'}, {'rating': 'Valoración: 5\xa0estrellas', 'date': 'Valoración: 5\xa0estrellas,  · Hace 3 semanas', 'review': 'Excelente ubicación y a poca distancia a pie del transporte público.¡Consejo para el departamento! Ideal para familias, una cama de matrimonio y una litera. Comunicación con Roberto perfecta, da excelentes consejos, ¡nada puede salir mal!Un gran anfitrión y muy recomendable!!!!'}, {'rating': 'Valoración: 5\xa0estrellas', 'date': 'Valoración: 5\xa0estrellas,  · Hace 4 semanas', 'review': 'Fue genial. Proceso sin problemas, consejos e indicaciones excelentes. Además, pudimos dejar el equipaje antes de la llegada. Nos encantaría volver cuando quieras...'}, {'rating': 'Valoración: 5\xa0estrellas', 'date': 'Valoración: 5\xa0estrellas,  · septiembre de 2024', 'review': 'Mis amigos y yo pasamos una estancia muy agradable en la propiedad de Roberto.Estaba muy limpio y espacioso, y Roberto fue genial comunicándose con muchas recomendaciones durante toda nuestra  estancia.'}]","1 cama de matrimonio grande","2 camas individuales"
"Havitacion privada en Solsona a un par de minutos de dos supermercados y a 10 minutos del centro de la ciudad.","26 €","4,94 (16)","['Bañera', 'Champú', 'Gel de ducha', 'Bidé', 'Agua caliente', 'Gel de ducha', 'Lavadora', 'Servicios básicos', 'Ropa de cama', 'Conexión Ethernet', 'Calefacción radiante', 'Wifi móvil', 'Cocina', 'Frigorífico', 'Utensilios básicos de cocina', 'Platos y cubiertos', 'Frigorífico mini', 'Congelador', 'Lavavajillas', 'Horno', 'Cafetera', 'Arrocera', 'Café', 'Aparcamiento gratuito en la calle', 'Ascensor', 'Se permite dejar el equipaje', 'Limpieza disponible durante la estancia', 'Recepción por parte del anfitrión', 'No disponible: Cerradura en la puerta del dormitorio', 'No disponible: Cámaras de seguridad en los exteriores de la propiedad', 'No disponible: Wifi', 'No disponible: TV', 'No disponible: Secadora', 'No disponible: Aire acondicionado', 'No disponible: Detector de humo', 'No disponible: Detector de monóxido de carbono']","['Anfitrión particular', 'Número de registro: Exempt']","[{'rating': 'Valoración: 5\xa0estrellas', 'date': 'Valoración: 5\xa0estrellas,  · septiembre de 2024', 'review': 'ha ido todo genial'}, {'rating': 'Valoración: 5\xa0estrellas', 'date': 'Valoración: 5\xa0estrellas,  · agosto de 2024', 'review': 'Jordi es un Superanfitrión, extremadamente amable y simpático. Nos encantaría volver.'}, {'rating': 'Valoración: 4\xa0estrellas', 'date': 'Valoración: 4\xa0estrellas,  · agosto de 2024', 'review': 'todo bien'}, {'rating': 'Valoración: 5\xa0estrellas', 'date': 'Valoración: 5\xa0estrellas,  · julio de 2024', 'review': 'Interacción muy amable y gran proceso!'}, {'rating': 'Valoración: 5\xa0estrellas', 'date': 'Valoración: 5\xa0estrellas,  · junio de 2024', 'review': 'Buena estancia en Solsona, Jordi fue amigable y estuvo siempre cuando tenía alguna duda. Regresaré pronto.'}, {'rating': 'Valoración: 5\xa0estrellas', 'date': 'Valoración: 5\xa0estrellas,  · abril de 2024', 'review': 'muy agradable y buen recibimiento... cordialmente Albert Gerbod'}]",NA,NA
