"title","price","rating","amenities","numero_registro","reviews","Dormitorio 1","Dormitorio 2"
"L. HUTB008464 Apartamento ""Evangelina""","127 €","4,83 (383)","['Bañera', 'Secador de pelo', 'Bidé', 'Agua caliente', 'Lavadora', 'Servicios básicos', 'Perchas', 'Ropa de cama', 'Persianas o cortinas opacas', 'Plancha', 'Tendedero para ropa', 'Espacio para guardar la ropa: armario', 'Conexión Ethernet', 'TV', 'Cuna', 'Libros y juguetes para niños', 'Trona', 'Platos y cubiertos para niños', 'Aire acondicionado centralizado', 'Calefacción', 'Wifi', 'Cocina', 'Frigorífico', 'Microondas', 'Utensilios básicos de cocina', 'Platos y cubiertos', 'Congelador', 'Fogón', 'Horno', 'Hervidor de agua', 'Cafetera', 'Copas de vino', 'Tostadora', 'Bandeja de repostería', 'Mesa de comedor', 'Patio o balcón', 'Aparcamiento gratuito en las instalaciones', 'Ascensor', 'Alojamiento de una altura', 'Recepción por parte del anfitrión', 'No disponible: Cámaras de seguridad en los exteriores de la propiedad', 'No disponible: Secadora', 'No disponible: Detector de humo', 'No disponible: Detector de monóxido de carbono']","['Anfitrión particular', 'Número de registro: HUTB-008464']","[{'rating': 'Valoración: 5\xa0estrellas', 'date': 'Valoración: 5\xa0estrellas,  · noviembre de 2024', 'review': 'Ubicación ideal, el apartamento en todas sus condiciones, lo único fue el trato de la anfitriona, nada cortés y amable'}, {'rating': 'Valoración: 5\xa0estrellas', 'date': 'Valoración: 5\xa0estrellas,  · noviembre de 2024', 'review': 'El apartamento se encuentra en una bonita residencia … aparcamiento privado muy apreciable cerca de un Mercadona bien surtido para las compras diarias .El apartamento se encuentra cerca de todas las comodidades …'}, {'rating': 'Valoración: 5\xa0estrellas', 'date': 'Valoración: 5\xa0estrellas,  · octubre de 2024', 'review': 'Bonito alojamiento . Perfecto para una familia de cuatro personas . La mayoría de los lugares están a 30-40 minutos a pie . Limpio . Las camas eran un poco incómodas . Hay un supermercado en la planta baja. El anfitrión responde con rapidez a cualquier consulta . Disfrutamos de una estancia encantadora'}, {'rating': 'Valoración: 4\xa0estrellas', 'date': 'Valoración: 4\xa0estrellas,  · octubre de 2024', 'review': '¡Excelente ubicación y apartamento! El registro de entrada es complicado, te cobrarán 30 euros si llegas después de las 10 pm y 50 euros si llegas después de la medianoche. No te dejan entrar si llegas más tarde de las 2 de la mañana.'}, {'rating': 'Valoración: 5\xa0estrellas', 'date': 'Valoración: 5\xa0estrellas,  · octubre de 2024', 'review': ""Gran garaje de aparcamiento. Mercado (tienda de comestibles) a 500’de la manzana. Gran italiano y pizza a 2 manzanas en Gusto. Grandes tapas y comida/bar en Bassy's a 3 cuadras. Me lo pasé muy bien. Muy recomendable.""}, {'rating': 'Valoración: 5\xa0estrellas', 'date': 'Valoración: 5\xa0estrellas,  · octubre de 2024', 'review': 'La ubicación de esta casa es excelente; todo está a poca distancia, haciendo que ir de compras y cenas sea muy conveniente. La casa está muy limpia y segura, y está equipada con todos los servicios necesarios. El anfitrión proporcionó instrucciones detalladas para cada paso. Tuvimos una estancia muy agradable de dos días aquí y recomendamos encarecidamente esta casa a nuestros amigos.'}]",NA,NA
"Apartamento ""El ÁLAMO""","66 €","4,82 (305)","['Secador de pelo', 'Productos de limpieza', 'Champú', 'Gel de ducha', 'Agua caliente', 'Gel de ducha', 'Servicios básicos', 'Perchas', 'Ropa de cama', 'Almohadas y mantas adicionales', 'Persianas o cortinas opacas', 'Plancha', 'Tendedero para ropa', 'TV', 'Cuna', 'Parque/cunas de viaje', 'Trona independiente', 'Seguros para ventanas', 'Aire acondicionado', 'Calefacción', 'Wifi rápido (133 Mbps)', 'Cocina', 'Frigorífico', 'Microondas', 'Utensilios básicos de cocina', 'Platos y cubiertos', 'Fogón', 'Horno', 'Hervidor de agua', 'Cafetera', 'Copas de vino', 'Mesa de comedor', 'Café', 'Entrada independiente', 'Lavandería cercana', 'Patio privado o balcón', 'Patio trasero', 'Aparcamiento gratuito en las instalaciones', 'Aparcamiento gratuito en la calle', 'Se permite dejar el equipaje', 'Disponible para estancias largas', 'Recepción por parte del anfitrión', 'No disponible: Lavadora', 'No disponible: Secadora', 'No disponible: Detector de humo', 'No disponible: Detector de monóxido de carbono']","['Anfitrión particular']","[{'rating': 'Valoración: 5\xa0estrellas', 'date': 'Valoración: 5\xa0estrellas,  · Hace 5\xa0días', 'review': 'El apartamento de Alexandre está en una zona muy bonita. Tranquilo La estación está a dos pasos. Una plaza de aparcamiento en frente de su puerta de garaje está disponible. La terraza del apartamento permite disfrutar de un exterior y de unas agradables vistas. El apartamento está bien hecho. Un click clac en el salón. Cocina funcional Un dormitorio independiente y el baño contiguo. Tenia de todo. Gracias'}, {'rating': 'Valoración: 4\xa0estrellas', 'date': 'Valoración: 4\xa0estrellas,  · Hace 1 semana', 'review': 'Alexandre se encargó de todo. Respondió rápidamente a mis deseos y sugerencias. La ubicación, muy cerca de mi hijo y su familia, y la proximidad a la estación de tren fue óptima para mí. Me encantaría volver.'}, {'rating': 'Valoración: 5\xa0estrellas', 'date': 'Valoración: 5\xa0estrellas,  · Hace 2 semanas', 'review': '¡Alexandre es un anfitrión muy atento, receptivo y amable! El alojamiento está en un barrio tranquilo. Él mismo está bien equipado. Tuvimos una buena estancia, lo recomendamos'}, {'rating': 'Valoración: 5\xa0estrellas', 'date': 'Valoración: 5\xa0estrellas,  · Hace 3 semanas', 'review': 'Muy recomendable anfitrión atento y amable en todo <U+0001F44C><U+0001F3FB>'}, {'rating': 'Valoración: 4\xa0estrellas', 'date': 'Valoración: 4\xa0estrellas,  · noviembre de 2024', 'review': 'Muy servicial. Gran estancia, lástima por el poco servicio, nombre del supermercado... solo hay uno cerca.'}, {'rating': 'Valoración: 5\xa0estrellas', 'date': 'Valoración: 5\xa0estrellas,  · noviembre de 2024', 'review': 'Pasamos una muy buena estancia en casa de Alexandre, que es un anfitrión acogedor y muy amable. En particular, apreciamos que Alexandre hable francés con nosotros aunque no es su idioma original. El alojamiento es bien equipado, limpio y funcional. Estábamos a menos de 5 minutos del metro, lo que nos permite llegar al centro de Barcelona en 20-30 minutos (según la zona deseada). Así que estábamos muy tranquilos por la noche, para descansar.'}]",NA,NA
"Dormitorio compartido mix 4 camas, baño compartido","26 €","5,0 (16)","['Secador de pelo', 'Agua caliente', 'Lavadora', 'Secadora en el edificio (De pago)', 'Plancha', 'Juegos de mesa', 'Aire acondicionado', 'Calefacción', 'Cámaras de seguridad en los exteriores de la propiedad', 'Detector de humo', 'Detector de monóxido de carbono', 'Extintor de incendios', 'Botiquín', 'Wifi', 'Zona para trabajar', 'Cocina', 'Utensilios básicos de cocina', 'Comedor al aire libre', 'Bicicletas', 'Ascensor', 'Aparcamiento de pago en garaje fuera de la propiedad', 'Llegada autónoma', 'Personal en el edificio', 'No disponible: TV', 'No disponible: Servicios básicos', 'No disponible: Champú']","['Mostrar los datos de la empresa', 'Número de registro: AJ000739']","[{'rating': 'Valoración: 5\xa0estrellas', 'date': 'Valoración: 5\xa0estrellas,  · Hace 1\xa0día', 'review': '¡La decoración de moda, la ubicación del inodoro conveniente! ¡Y con un comedor y dos terrazas al lado es realmente un plus! ¡Voy a elegir este albergue juvenil si la próxima vez paso por Barcelona!'}, {'rating': 'Valoración: 5\xa0estrellas', 'date': 'Valoración: 5\xa0estrellas,  · Hace 4\xa0días', 'review': 'Fue una muy buena estadía. El personal del hostal es muy amable y siempre hace todo lo posible para entretener a los huéspedes. Las camas están bien. Todo estaba limpio. 2 estaciones de metro están cerca del hostal, lo que me ayudó a desplazarme por la ciudad. Espero volver a estar allí. <U+0001F942>'}, {'rating': 'Valoración: 5\xa0estrellas', 'date': 'Valoración: 5\xa0estrellas,  · Hace 4\xa0días', 'review': 'Muy recomendable el lugar, excelente en líneas generales y Gracias por todo a Augusto y Miguel y también a un muchacho de Rumanía fachero de barba de la recepción que no recuerdo el nombre un honor y privilegio conocerlos,Gracias  Volveré nuevamente!!'}, {'rating': 'Valoración: 5\xa0estrellas', 'date': 'Valoración: 5\xa0estrellas,  · Hace 5\xa0días', 'review': 'Una estancia muy agradable muchas gracias por todo y muchas gracias por la chica que trabaja en la cafetería que habla francés <U+0001F49D> muchas gracias por allí traducción'}, {'rating': 'Valoración: 5\xa0estrellas', 'date': 'Valoración: 5\xa0estrellas,  · Hace 6\xa0días', 'review': 'excelente estancia, muy cómodo y buena ubicación'}, {'rating': 'Valoración: 5\xa0estrellas', 'date': 'Valoración: 5\xa0estrellas,  · Hace 1 semana', 'review': 'Una bonita recepción,, el lugar es tranquilo y su ubicación está cerca de la mayoría de los lugares turísticos, gracias <U+0001F601>'}]",NA,NA
"Apto. céntrico ideal para parejas","89 €","4,62 (499)","['Secador de pelo', 'Champú', 'Agua caliente', 'Lavadora', 'Servicios básicos', 'TV', 'Aire acondicionado', 'Calefacción', 'Wifi', 'Cocina', 'Frigorífico', 'Microondas', 'Utensilios básicos de cocina', 'Platos y cubiertos', 'Fogón', 'Cafetera', 'Ascensor', 'Llegada autónoma', 'Caja de seguridad para llaves', 'No disponible: Secadora', 'No disponible: Detector de humo', 'No disponible: Detector de monóxido de carbono']","['Anfitrión profesional', 'Número de registro: HUTB-012895']","[{'rating': 'Valoración: 5\xa0estrellas', 'date': 'Valoración: 5\xa0estrellas,  · Hace 2 semanas', 'review': 'Alojamiento fiel a la descripción , buena ubicación cerca del metro Muy buena estancia'}, {'rating': 'Valoración: 5\xa0estrellas', 'date': 'Valoración: 5\xa0estrellas,  · Hace 3 semanas', 'review': 'Nos quedamos 2 noches y fue increíble! el departamento súper equipado, con toallas y sábanas limpias. Teníamos miedo de que no esté lo suficientemente equipado pero nos sorprendió. Hasta lavamos la ropa. Una hermosa visita a Barcelona.'}, {'rating': 'Valoración: 5\xa0estrellas', 'date': 'Valoración: 5\xa0estrellas,  · Hace 3 semanas', 'review': 'Todo muy bien,  espero volver pronto.'}, {'rating': 'Valoración: 4\xa0estrellas', 'date': 'Valoración: 4\xa0estrellas,  · Hace 4 semanas', 'review': 'Todo lindo y tranquilo'}, {'rating': 'Valoración: 5\xa0estrellas', 'date': 'Valoración: 5\xa0estrellas,  · noviembre de 2024', 'review': 'El apartamento está muy limpio y es confortable. Adrià fue muy receptiva y las instrucciones de entrada y salida eran muy claras. Recomiendo de ver de veras este alojamiento.'}, {'rating': 'Valoración: 4\xa0estrellas', 'date': 'Valoración: 4\xa0estrellas,  · noviembre de 2024', 'review': 'Alojamiento pequeño y cómodo. Todo lo necesario para un fin de semana en Barcelona. Una cama francesa, pero en dos personas se puede dormir bien. Cama muy CÓMODA. Calefacción con aire acondicionado que hace un poco de ruido. Excelente ubicación junto al METRO azul de BADAL.'}]",NA,NA
"Habitación doble en centro-Ramblas/AC","36 €","4,35 (75)","['Secador de pelo', 'Productos de limpieza', 'Champú', 'Gel de ducha', 'Agua caliente', 'Servicios básicos', 'Perchas', 'Ropa de cama', 'Almohadas y mantas adicionales', 'Persianas o cortinas opacas', 'Plancha', 'Aire acondicionado', 'Calefacción', 'Cerradura en la puerta del dormitorio', 'Wifi', 'Zona para trabajar', 'Cocina', 'Frigorífico', 'Microondas', 'Utensilios básicos de cocina', 'Platos y cubiertos', 'Congelador', 'Fogón', 'Horno', 'Cafetera', 'Copas de vino', 'Mesa de comedor', 'No disponible: Cámaras de seguridad en los exteriores de la propiedad', 'No disponible: TV', 'No disponible: Lavadora', 'No disponible: Secadora', 'No disponible: Detector de humo', 'No disponible: Detector de monóxido de carbono']","['Anfitrión particular', 'Número de registro: Exempt']","[{'rating': 'Valoración: 4\xa0estrellas', 'date': 'Valoración: 4\xa0estrellas,  · Hace 2 semanas', 'review': 'Nuestro anfitrión fue muy complaciente, estamos agradecidos de que haya aceptado dejar el equipaje antes de la hora de llegada. El apartamento estaba muy limpio, se podía sentir la humedad, dada la ubicación cercana al mar. Arriba estaba en remodelación, por lo que era ruidoso durante las horas permitidas. La ubicación está muy cerca del metro y en el centro. No la recomiendo para una sola mujer, por muchos vagabundos.'}, {'rating': 'Valoración: 3\xa0estrellas', 'date': 'Valoración: 3\xa0estrellas,  · Hace 2 semanas', 'review': 'Angie fue una gran anfitriona, amable y atenta. Las habitaciones del piso eran muy bonitas. Acabamos de conseguir el que tiene poca ventilación. La ropa de cama y las almohadas podrían haber sido más cómodas. El apartamento de un vecino estaba siendo renovado, por lo que a veces era ruidoso.La ubicación era buena, no era el barrio más bonito porque es el centro de la ciudad, pero es muy fácil llegar a lugares, y el Barrio Gótico estaba justo al otro lado de la calle. Todo lo demás fue muy amable y limpio. En general, una buena experiencia!'}, {'rating': 'Valoración: 5\xa0estrellas', 'date': 'Valoración: 5\xa0estrellas,  · Hace 3 semanas', 'review': 'Todo excelente! Buena ubicación y muy limpio'}, {'rating': 'Valoración: 5\xa0estrellas', 'date': 'Valoración: 5\xa0estrellas,  · noviembre de 2024', 'review': 'Estuvo genial el lugar estaba muy limpio y muy bien instrucciones muy cerca de todo ! Gracias'}, {'rating': 'Valoración: 5\xa0estrellas', 'date': 'Valoración: 5\xa0estrellas,  · noviembre de 2024', 'review': 'Todo increible con Angie! pasamos el finde en el piso fue muy lindo y bueno'}, {'rating': 'Valoración: 5\xa0estrellas', 'date': 'Valoración: 5\xa0estrellas,  · noviembre de 2024', 'review': 'eExcelente, todo Limpio y muy buena zona cerca de todo y del metro para poder pasear por Barcelona, Nathalia muy Atenta y siempre responde rápido'}]",NA,NA
"Apartamento Barcelona el Prat","61 €","4,64 (176)","['Vistas al parque', 'Bañera', 'Secador de pelo', 'Champú de hacendado', 'Gel de ducha de hacendado', 'Bidé', 'Agua caliente', 'Gel de ducha', 'Lavadora (en el edificio)', 'Secadora (en el edificio)', 'Servicios básicos', 'Ropa de cama', 'Almohadas y mantas adicionales', 'Plancha', 'Tendedero para ropa', 'Mosquitera', 'Espacio para guardar la ropa: cómoda', 'TV', 'Juegos recreativos', 'Cine', 'Ventiladores portátiles', 'Botiquín', 'Wifi rápido (59 Mbps)', 'Cocina', 'Frigorífico', 'Microondas', 'Utensilios básicos de cocina', 'Platos y cubiertos', 'Congelador', 'Fogón', 'Horno', 'Cafetera', 'Copas de vino', 'Acceso compartido a la playa', 'Lavandería cercana', 'Aparcamiento gratuito en las instalaciones', 'Aparcamiento gratuito en la calle', 'Ascensor', 'Admite mascotas', 'Se permite dejar el equipaje', 'Apto para fumadores', 'Recepción por parte del anfitrión', 'No disponible: Cámaras de seguridad en los exteriores de la propiedad', 'No disponible: Aire acondicionado', 'No disponible: Detector de humo', 'No disponible: Detector de monóxido de carbono', 'No disponible: Calefacción']","['Anfitrión particular', 'Número de registro: Exempt']","[{'rating': 'Valoración: 5\xa0estrellas', 'date': 'Valoración: 5\xa0estrellas,  · Hace 2 semanas,  · Viaje con niños', 'review': '¡Gran lugar en una zona tranquila para alojarse cerca del aeropuerto de Prat! ¡A poca distancia del interior de Barcelona, pero la estación de metro está a poca distancia a pie! El apartamento era genial y espacioso y lo recomendaría a cualquier persona que esté buscando alojamiento con la familia.'}, {'rating': 'Valoración: 4\xa0estrellas', 'date': 'Valoración: 4\xa0estrellas,  · Hace 2 semanas', 'review': 'Apartamento muy agradable fuimos con dos amigos de vacaciones y fue genial , un muy buen trato por parte de Teresa'}, {'rating': 'Valoración: 5\xa0estrellas', 'date': 'Valoración: 5\xa0estrellas,  · Hace 2 semanas', 'review': 'Excelente'}, {'rating': 'Valoración: 3\xa0estrellas', 'date': 'Valoración: 3\xa0estrellas,  · Hace 3 semanas', 'review': 'vale.'}, {'rating': 'Valoración: 5\xa0estrellas', 'date': 'Valoración: 5\xa0estrellas,  · Hace 3 semanas', 'review': 'Precioso anfitrión y apartamento. Todo lo que necesitamos x'}, {'rating': 'Valoración: 5\xa0estrellas', 'date': 'Valoración: 5\xa0estrellas,  · Hace 3 semanas', 'review': 'Teresa fue una anfitriona increible. Siempre pendiente a todo y muy flexible. Excelente predisposicion! Gracias!! Volveremos!'}]",NA,NA
"Capacidad para 1","27 €","4,62 (58)","['Secador de pelo', 'Agua caliente', 'Servicios básicos', 'Plancha', 'Aire acondicionado', 'Sistema de calefacción sin conductos tipo split', 'Cerradura en la puerta del dormitorio', 'Wifi', 'Zona para trabajar', 'Cocina', 'Microondas', 'Platos y cubiertos', 'Hervidor de agua', 'Cafetera: máquina de café expreso', 'Copas de vino', 'Lavandería cercana', 'Aparcamiento de pago en garaje fuera de la propiedad', 'No disponible: Cámaras de seguridad en los exteriores de la propiedad', 'No disponible: TV', 'No disponible: Lavadora', 'No disponible: Secadora', 'No disponible: Detector de humo', 'No disponible: Detector de monóxido de carbono']","No information","[{'rating': 'Valoración: 3\xa0estrellas', 'date': 'Valoración: 3\xa0estrellas,  · Hace 5\xa0días', 'review': 'Si no tienes demasiado tiempo para pasar en Barcelona, puedes alquilar este alojamiento a un precio razonable. Es fácil llegar al centro de la ciudad. Este alojamiento no se encuentra en una región agradable.'}, {'rating': 'Valoración: 5\xa0estrellas', 'date': 'Valoración: 5\xa0estrellas,  · Hace 2 semanas', 'review': 'Este es el lugar perfecto para que los viajeros solitarios exploren Barcelona. Todo tal cual se describe y está muy céntrico. Si Barcelona está sola, este es tu lugar ideal.'}, {'rating': 'Valoración: 5\xa0estrellas', 'date': 'Valoración: 5\xa0estrellas,  · Hace 3 semanas', 'review': 'El apartamento está cerca del barrio gótico y puedes ir y venir fácilmente a la ubicación turística. Fue una experiencia estupenda y una forma fácil de comunicarse.Nicolas es amable y el precio era asequible.'}, {'rating': 'Valoración: 5\xa0estrellas', 'date': 'Valoración: 5\xa0estrellas,  · noviembre de 2024', 'review': '¡Anfitrión perfecto para descansar!'}, {'rating': 'Valoración: 5\xa0estrellas', 'date': 'Valoración: 5\xa0estrellas,  · noviembre de 2024', 'review': 'El mejor anfitrión de Barcelona! habitación privada más cercana a la playa! Entorno muy limpio, tranquilo y amigable. Muy recomendable para viajeros!'}, {'rating': 'Valoración: 5\xa0estrellas', 'date': 'Valoración: 5\xa0estrellas,  · noviembre de 2024', 'review': 'Nicolas es muy acogedor y el apartamento estaba impecable.'}]",NA,NA
"Un hogar a pocos metros del parque de Montjuic","77 €","4,69 (55)","['Bañera', 'Secador de pelo', 'Champú', 'Acondicionador', 'Gel de ducha', 'Agua caliente', 'Gel de ducha', 'Lavadora en el alojamiento (Gratis)', 'Secadora en el alojamiento (Gratis)', 'Servicios básicos', 'Perchas', 'Ropa de cama', 'Persianas o cortinas opacas', 'Plancha', 'Tendedero para ropa', 'Espacio para guardar la ropa: armario', 'Conexión Ethernet', 'Televisión de 32 pulgadas', 'Cuna', 'Parque/cunas de viaje: disponible previa solicitud', 'Trona de mesa: disponible previa solicitud', 'Sistema de aire acondicionado sin conductos tipo split', 'Ventilador de techo', 'Calefactor portátil', 'Monitores de decibelios en la propiedad', 'Detector de humo', 'Detector de monóxido de carbono', 'Wifi', 'Zona para trabajar', 'Cocina', 'Frigorífico', 'Microondas', 'Utensilios básicos de cocina', 'Platos y cubiertos', 'Congelador', 'Cocina eléctrica', 'Horno', 'Hervidor de agua', 'Cafetera: Nespresso', 'Copas de vino', 'Tostadora', 'Mesa de comedor', 'Ascensor', 'Admite mascotas', 'Llegada autónoma', 'Cerradura inteligente', 'No disponible: Entrada independiente']","['Anfitrión profesional', 'Número de registro: HUTB-001803']","[{'rating': 'Valoración: 5\xa0estrellas', 'date': 'Valoración: 5\xa0estrellas,  · Hace 1 semana', 'review': 'El apartamento estaba muy bien, pero hubo dos problemas a los que nos enfrentamos que no había utensilios adecuados en la cocina y la secadora no funcionaba. Excepto esto muy bien todo y el piso muy limpio'}, {'rating': 'Valoración: 4\xa0estrellas', 'date': 'Valoración: 4\xa0estrellas,  · Hace 2 semanas', 'review': 'El apartamento 5.1 se encuentra en un barrio cerca de la colina de Montjuïc. La zona está llena de tiendas y bares, pero es tranquila en el apartamento. El precio que se muestra por día por habitación no incluye la tarifa de alojamiento de unos 6,25 € por persona por día durante 3 días = 75 € por 4 personas, se paga por separado en un sitio web que también te ofrece el código de acceso al apartamento. Las fotos son reales mirando las cámaras.  El apartamento cuenta con la amplia cocina con todos los utensilios para cocinar.'}, {'rating': 'Valoración: 5\xa0estrellas', 'date': 'Valoración: 5\xa0estrellas,  · noviembre de 2024', 'review': 'Todo bien, cerca a todo'}, {'rating': 'Valoración: 5\xa0estrellas', 'date': 'Valoración: 5\xa0estrellas,  · noviembre de 2024', 'review': 'Todo era como se describe. Nos lo pasamos muy bien. Gracias por todo'}, {'rating': 'Valoración: 5\xa0estrellas', 'date': 'Valoración: 5\xa0estrellas,  · noviembre de 2024', 'review': 'Tuvimos una estancia estupenda, todo era como se anunciaba y como se ve en las fotos. Comunicación clara con el anfitrión, cómoda interfaz de huésped por teléfono para entrar en la propiedad. Sin quejas.'}, {'rating': 'Valoración: 5\xa0estrellas', 'date': 'Valoración: 5\xa0estrellas,  · noviembre de 2024', 'review': 'El lugar para una escapada corta es realmente genial, todo el transporte público a 5 minutos, super pubs y cafeterías. Todo lo que debería haber estado en el departamento, pero la mayor parte del tiempo se pasa al aire libre <U+0001F642> Saludos, y lo recomendamos al máximo <U+0001F642>'}]",NA,NA
"Apartamento al lado de Sagrada Familia con Wifi y aire","69 €","4,33 (317)","['Secador de pelo', 'Servicios básicos', 'Perchas', 'Ropa de cama', 'Plancha', 'TV', 'Trona: disponible previa solicitud', 'Aire acondicionado', 'Calefacción', 'Wifi', 'Zona para trabajar', 'Cocina', 'Frigorífico', 'Microondas', 'Platos y cubiertos', 'Fogón', 'Horno', 'Cafetera', 'Tostadora', 'Patio o balcón', 'Ascensor', 'Recepción por parte del anfitrión', 'No disponible: Lavadora', 'No disponible: Detector de humo', 'No disponible: Detector de monóxido de carbono', 'No disponible: Champú', 'No disponible: Entrada independiente']","['Anfitrión profesional', 'Número de registro: HUTB-010256']","[{'rating': 'Valoración: 4\xa0estrellas', 'date': 'Valoración: 4\xa0estrellas,  · Hace 2 semanas,  · Viaje con niños', 'review': 'La ubicación es excepcional de eso no hay duda , solo que si es cierto q el baño no es apto es demasía PEQUEÑO apenas cabes en la ducha , por otro lado es algo ruidoso logras escuchar todo lo qué pasa en los otros departamento, tuvimos q infórmale al anfitrión y nos respondió hasta el otro día ,  o fue de mucha ayuda , x lo de mas sitio limpio ordenado y de Facil acceso !!!'}, {'rating': 'Valoración: 4\xa0estrellas', 'date': 'Valoración: 4\xa0estrellas,  · Hace 2 semanas', 'review': 'primero las comodidades del baño, minúsculo.  lavabo, incluso estaño, ducha pequeña. cocina, pequeña, nevera pequeña. dormitorio 2 se adapta a 2 camas pequeñas pero no equipajepros: sala de estar razonable, el dormitorio 1 se adapta al equipaje. El ascensor funciona, pero sube corta.ubicación, por supuesto, lo  mejor es despertarse junto a la sagrada. El metro está a solo 1 minuto a pie. El calentador funcionaba, a pesar de ser una unidad pequeña, los 4 lo hicimos funcional, excelente anfitrión.  una ubicación más céntrica estaría cerca de Catalunya plaza, que es donde se hará más de tu caminata. En general, contento con el lugar y tuve una estancia encantadora.'}, {'rating': 'Valoración: 3\xa0estrellas', 'date': 'Valoración: 3\xa0estrellas,  · Hace 2 semanas', 'review': 'Lindo apartamento en general y solo por el precio. Lo único no muy bien es que el tamaño es más pequeño de lo que se ve en las fotos y se indica en el sitio, pero para el uso que tuvimos no fue gran cosa.Excelente ubicación en general desde detrás de la Sagrada Familia y cerca del metro'}, {'rating': 'Valoración: 5\xa0estrellas', 'date': 'Valoración: 5\xa0estrellas,  · Hace 3 semanas', 'review': '.'}, {'rating': 'Valoración: 3\xa0estrellas', 'date': 'Valoración: 3\xa0estrellas,  · Hace 3 semanas', 'review': 'aceptable para dormir'}, {'rating': 'Valoración: 5\xa0estrellas', 'date': 'Valoración: 5\xa0estrellas,  · Hace 4 semanas', 'review': 'Gran valor y ubicaciónProceso de llegada sencillo y personal amableLo recomendaría y me hospedaría de nuevo.'}]","1 cama de matrimonio","2 camas individuales"
